article_id,question_1,question_2,question_3,question_4,question_5,question_6,question_7,question_8,question_9,question_10
16,Quelles sont les trois principales catégories dans lesquelles le contrat de travail peut être conclu selon l'article ?,Dans quelles situations est-il permis de conclure un contrat de travail à durée déterminée (CDD) ? Énumérez au moins trois cas spécifiques mentionnés.,Quel est le cas où la suspension du contrat de travail ne permet pas la conclusion d'un CDD selon l'article ?,Pour quelles raisons peut-on conclure un CDD dans certains secteurs et sous certaines conditions exceptionnelles ?,Quelle procédure doit être suivie pour fixer les cas spécifiques où le CDD peut être conclu dans des secteurs particuliers ?,Quel est l'impact d'un état de grève sur la conclusion d'un contrat de travail à durée déterminée ?,Dans quelles activités peut-on envisager une augmentation temporaire qui justifie la conclusion d'un CDD selon l'article ?,"Le travail saisonnier est-il mentionné comme un cas où le CDD peut être conclu ? Si oui, comment est-ce défini dans l'article ?",Quelles organisations doivent donner leur avis avant que les conditions exceptionnelles pour conclure un CDD ne soient fixées par voie réglementaire ?,Le contrat de travail à durée déterminée peut-il être utilisé dans tous les secteurs d'activité selon l'article ?
17,Quelle est la durée maximale d'un contrat de travail à durée déterminée dans les secteurs autres que l'agricole ?,Combien peut-on renouveler un contrat de travail à durée déterminée pour une période maximum d'une année dans les secteurs autres que l'agricole ?,"Après la période maximale, quel type de contrat devient-il automatiquement ?",Dans lequel des secteurs est mentionné un délai différent pour le renouvellement du contrat à durée déterminée ?,Quelle est la durée maximale d'un contrat de travail à durée déterminée dans l'agricole selon cet article ?,Est-il possible de renouveler ce type de contrat au-delà de cette durée dans le secteur agricole ?,Quel est le maximum total de temps que peut couvrir un contrat de travail à durée déterminée dans le secteur agricole ?,Que se passe-t-il si le contrat de travail à durée déterminée est maintenu au-delà de sa durée maximale dans les secteurs autres que l'agricole ?,Dans quel secteur est mentionné un processus spécial pour la transformation d'un contrat à durée déterminée en contrat à durée indéterminée ?,Quelle est la conséquence juridique si le contrat de travail à durée déterminée est maintenu au-delà de sa durée maximale dans l'agricole ?
18,Quels moyens peuvent être utilisés pour prouver l'existence du contrat de travail ?,Quel type de contrat de travail est exempté des droits d'enregistrement selon cet article ?,Peut-on utiliser des moyens oraux pour prouver l'existence du contrat de travail ?,Est-ce que tous les contrats de travail écrits sont exonérés des droits d'enregistrement ?,Quelles autres preuves peuvent être utilisées en plus des moyens mentionnés ?,Le Code du travail précise-t-il quelles sont ces preuves spécifiques ?,Comment peut-on prouver l'existence d'un contrat de travail si celui-ci n'est pas écrit ?,Est-ce que le contrat de travail doit être notarié pour bénéficier de cette exonération ?,Quels sont les autres conséquences du fait que le contrat soit établi par écrit selon ce code ?,Peut-on prouver l'existence d'un contrat de travail par des moyens indirects ?
19,Quels types de modifications peuvent affecter la situation juridique de l'employeur selon l'article ?,Dans quel cas les contrats en cours subsistent-ils entre les salariés et le nouvel employeur ?,Quelles obligations prend le nouvel employeur vis-à-vis des salariés après une modification dans la situation juridique de l'employeur ?,Quels avantages conservent les salariés liés par un contrat de travail à durée indéterminée lors d'un mouvement interne au sein de l'établissement ou du groupe d'entreprises ?,Peut-on modifier les droits et acquis des salariés dans le cadre d'un mouvement interne si une entente plus favorable a été conclue entre les parties ?,Quels sont les éléments qui ne changent pas pour un salarié lors d'une mutation interne au sein de l'établissement ou du groupe d'entreprises ?,"Dans quel cas le service, la filiale ou l'établissement dans lequel est désigné le salarié n'affecte-t-il pas ses droits et acquis issus du contrat de travail ?",Quels sont les conséquences pour un employeur en cas de modification de sa situation juridique sur les contrats de travail existants ?,"Comment se comporte l'employeur après une modification de la forme juridique de l'entreprise, par exemple par privatisation ou fusion ?",Quels sont les droits et acquis des salariés qui sont préservés lors d'un mouvement interne au sein du groupe d'entreprises ?
20,Quels comportements du salarié sont-ils mentionnés comme faisant l'objet de sa responsabilité dans le cadre de son travail selon cet article ?,"Quelle est la nature de la responsabilité du salarié vis-à-vis de son acte, de sa négligence, de son impéritie ou de son imprudence ?",Dans quel contexte est définie la responsabilité du salarié dans ce texte ?,Peut-on considérer que l'employeur a également des obligations mentionnées dans cet article ?,Quels sont les termes utilisés pour décrire le comportement du salarié qui peut entraîner sa responsabilité ?,"Est-ce que cette responsabilité est limitée au cadre de travail uniquement, ou elle s'étend-elle à d'autres situations ?","Selon cet article, quel type de faute du salarié est-il mentionné comme faisant l'objet de sa responsabilité ?",Quels sont les termes utilisés pour décrire la négligence du salarié dans ce contexte juridique ?,Peut-on extrapoler des informations sur le statut du salarié ou de l'employeur à partir de cette disposition légale ?,Dans quel livre et titre se trouve cet article selon les informations fournies ?
